{
  "lot_id": "lot-001",
  "nature": "reel",
  "graine_maitresse": "graine-2026-11",
  "algorithme_ordre": "ordre-annotateur-v1",
  "date_creation": "2026-11-02T10:00:00+01:00",
  "annotateurs": ["a1", "a2"],
  "items": [
    {
      "item_id": "01JBANCESSAI00000000ITEM01",
      "item_version": 1,
      "item_empreinte": "a1a1a1a1a1a1a1a1a1a1a1a1a1a1a1a1a1a1a1a1a1a1a1a1a1a1a1a1a1a1a1a1",
      "candidat_id": "cand-a"
    },
    {
      "item_id": "01JBANCESSAI00000000ITEM02",
      "item_version": 1,
      "item_empreinte": "b2b2b2b2b2b2b2b2b2b2b2b2b2b2b2b2b2b2b2b2b2b2b2b2b2b2b2b2b2b2b2b2",
      "candidat_id": "cand-b"
    }
  ]
}
